{
  "repo_id": "antirez__kilo",
  "commit": "323d93b29bd89a2cb446de90c4ed4fea1764176e",
  "document_id": "rows_editing_persistence_1",
  "topic": "Rows, Editing, and Persistence",
  "topic_slug": "rows_editing_persistence",
  "difficulty": "easy",
  "generator": "claude_opus_4_7_rewrite_lean_prose",
  "prompt_version": "doc_derived_qa_generation_v0",
  "qa_pairs": [
    {
      "qa_id": "rows_editing_persistence_1_0001",
      "question": "How does kilo represent the editable file in memory?",
      "answer": "As an in-memory array of `erow` structures, each carrying the original characters of the line, a parallel rendered version, syntax-highlight metadata, and a small flag tracking whether the previous line ended inside a multiline comment.",
      "qa_set": "doc_derived",
      "document_id": "rows_editing_persistence_1"
    },
    {
      "qa_id": "rows_editing_persistence_1_0002",
      "question": "Why does each row store both an original character buffer and a rendered version?",
      "answer": "Because what shows on screen is not always the same as what is on disk; the rendered view exists for display.",
      "qa_set": "doc_derived",
      "document_id": "rows_editing_persistence_1"
    },
    {
      "qa_id": "rows_editing_persistence_1_0003",
      "question": "How are tab characters displayed inside a row?",
      "answer": "They are expanded into spaces up to the next eight-column tab stop so cursor positioning and highlighting line up with the visible output.",
      "qa_set": "doc_derived",
      "document_id": "rows_editing_persistence_1"
    },
    {
      "qa_id": "rows_editing_persistence_1_0004",
      "question": "What does `editorUpdateRow` do?",
      "answer": "When a row's underlying characters change, it rebuilds the rendered string and recomputes the highlight bytes for that row.",
      "qa_set": "doc_derived",
      "document_id": "rows_editing_persistence_1"
    },
    {
      "qa_id": "rows_editing_persistence_1_0005",
      "question": "What happens when a new row is inserted through `editorInsertRow`?",
      "answer": "The row array is reallocated, later rows shift down with their indices fixed, the new row's buffers are initialized, the rendered view is recomputed, and the file is marked dirty.",
      "qa_set": "doc_derived",
      "document_id": "rows_editing_persistence_1"
    },
    {
      "qa_id": "rows_editing_persistence_1_0006",
      "question": "What does `editorFreeRow` release before a row is deleted?",
      "answer": "The row's heap allocations for the original text, the rendered buffer, and the highlight bytes.",
      "qa_set": "doc_derived",
      "document_id": "rows_editing_persistence_1"
    },
    {
      "qa_id": "rows_editing_persistence_1_0007",
      "question": "What happens if `editorRowInsertChar` is asked to insert a character past the current end of a line?",
      "answer": "It first pads the row with spaces up to the requested column, then writes the character.",
      "qa_set": "doc_derived",
      "document_id": "rows_editing_persistence_1"
    },
    {
      "qa_id": "rows_editing_persistence_1_0008",
      "question": "How does `editorInsertChar` translate the visible cursor into a file position?",
      "answer": "It translates the visible cursor and scroll offsets into a file row and column, and creates an empty row at the end of the file when typing past the last line.",
      "qa_set": "doc_derived",
      "document_id": "rows_editing_persistence_1"
    },
    {
      "qa_id": "rows_editing_persistence_1_0009",
      "question": "What does `editorInsertNewline` do when the cursor is in the middle of a row?",
      "answer": "It splits the row at the cursor: the right half becomes a new row beneath the original, the original is truncated and its render data refreshed, and the cursor moves to the start of the new line.",
      "qa_set": "doc_derived",
      "document_id": "rows_editing_persistence_1"
    },
    {
      "qa_id": "rows_editing_persistence_1_0010",
      "question": "How does `editorDelChar` behave when the cursor is at column zero?",
      "answer": "It joins the current row to the previous one by appending the text and then deleting the original.",
      "qa_set": "doc_derived",
      "document_id": "rows_editing_persistence_1"
    },
    {
      "qa_id": "rows_editing_persistence_1_0011",
      "question": "What does `editorOpen` do when the requested file does not exist?",
      "answer": "It returns success, leaves the buffer empty, and lets the user save under that name later.",
      "qa_set": "doc_derived",
      "document_id": "rows_editing_persistence_1"
    },
    {
      "qa_id": "rows_editing_persistence_1_0012",
      "question": "How does `editorRowsToString` serialize the in-memory rows for saving?",
      "answer": "It concatenates all rows with a newline between each.",
      "qa_set": "doc_derived",
      "document_id": "rows_editing_persistence_1"
    },
    {
      "qa_id": "rows_editing_persistence_1_0013",
      "question": "What does `editorSave` do before reporting success?",
      "answer": "It opens or creates the target file, truncates it to the exact new length, writes the buffer in one call, closes the file, clears the dirty flag, and reports the number of bytes written.",
      "qa_set": "doc_derived",
      "document_id": "rows_editing_persistence_1"
    }
  ]
}
